{"blockers":[],"claim_sha256":"45357567cc551100aaac272ad912020446ba990de38826415f6fb84818031fbf","cleanup":"task_created_resource_absent","cleanup_outcome":"complete","commit_sha":"5c387b4208fc77b2af0220e878a88c6ddd44857e","completed_at":"2026-08-11T03:26:19.415946+00:00","counts":{"created":1,"deleted":1,"exact_readback":1},"denial_class":"authorization","gate_results":[{"name":"private_create","outcome":"PASS"},{"name":"exact_version_readback","outcome":"PASS"},{"name":"unauthenticated_access_denied","outcome":"PASS"},{"name":"claim_bound_cleanup","outcome":"PASS"}],"package_sha256":"a8974f275c6085b5cfcf345b88d97b712e34e470b81acd118ce3a3f1520325c5","privacy":"private","provider_ref":"zigomaro/mdh-private-canary-eb8a569b","provider_version":1,"run_id":"eb8a569b-59a8-48a7-ab59-73ff3fa13b1f","scenario":"private_dataset_create_exact_readback_unauthenticated_denial_delete","schema_version":"my-data-hub-real-kaggle-canary.v2","started_at":"2026-08-11T03:26:03.090446+00:00","task_id":"72f1de3d-b137-464d-953f-5721003c10e2","unauthenticated_http_status":403}