{"blockers":[],"claim_sha256":"5626d227a9e51652fa7eb3888ee1e3f456d1e626b490e95732f0642c6f6aaf63","cleanup":"task_created_resource_absent","cleanup_outcome":"complete","commit_sha":"13f1440dca20f7a99f785d3a0e2c44642b6f6503","completed_at":"2026-08-11T17:20:28.438426+00:00","counts":{"created":1,"deleted":1,"exact_readback":1},"denial_class":"authorization","gate_results":[{"name":"private_create","outcome":"PASS"},{"name":"exact_version_readback","outcome":"PASS"},{"name":"unauthenticated_access_denied","outcome":"PASS"},{"name":"claim_bound_cleanup","outcome":"PASS"}],"package_sha256":"bae0025533d5725bb8a0764ce1758dc7e34bd7d0e36b1239be401dd2bb4d719c","privacy":"private","provider_ref":"zigomaro/mdh-private-canary-0a59bfd0","provider_version":1,"run_id":"0a59bfd0-a5bd-4966-bc9f-9610a918d537","scenario":"private_dataset_create_exact_readback_unauthenticated_denial_delete","schema_version":"my-data-hub-real-kaggle-canary.v2","started_at":"2026-08-11T17:20:14.320253+00:00","task_id":"51c539f6-614d-4bdd-b64d-ccbd0554b6b7","unauthenticated_http_status":403}