{"blockers":[],"claim_sha256":"49ec952451df1e843fdeaea808a8e63fd4db5dc8c95a988fb19d7e842c69527c","cleanup":"task_created_resource_absent","cleanup_outcome":"complete","commit_sha":"0e52b30ff00f381960295cb145257324dfec5039","completed_at":"2026-08-11T18:52:12.163245+00:00","counts":{"created":1,"deleted":1,"exact_readback":1},"denial_class":"authorization","gate_results":[{"name":"private_create","outcome":"PASS"},{"name":"exact_version_readback","outcome":"PASS"},{"name":"unauthenticated_access_denied","outcome":"PASS"},{"name":"claim_bound_cleanup","outcome":"PASS"}],"package_sha256":"80838a9850a1584ec4b3a061a164b4341ae96086a31bc0e9526c6baa1848e2ad","privacy":"private","provider_ref":"zigomaro/mdh-private-canary-e84b637e","provider_version":1,"run_id":"e84b637e-fb20-4ff4-8e60-1a8be3e8805e","scenario":"private_dataset_create_exact_readback_unauthenticated_denial_delete","schema_version":"my-data-hub-real-kaggle-canary.v2","started_at":"2026-08-11T18:51:55.776348+00:00","task_id":"be592d45-a999-4819-a2aa-97852ccf193e","unauthenticated_http_status":403}